{
  "id": "test",
  "itemNumber": "SCP-CN-TEST",
  "title": "TEST",
  "objectClass": "Euclid",
  "threatLevel": "中等",
  "status": "稳定收容",
  "site": "Site-19 / 地下层 04",
  "clearanceLevel": "Level 3",
  "lastUpdated": "2026.07.12",
  "image": "OIP.jpg",
  "imageCaption": "图 01 — 收容单元 04 的监控画面。图像中部的圆形结构为 SCP-CN-███ 的可见开口。",
  "containmentProcedures": {
    "title": "特殊收容措施",
    "paragraphs": [
      "SCP-CN-███ 被收容于 Site-19 地下层 04 的隔音观察井内。收容单元须保持全封闭，除例行检修外不得开启井盖。",
      "任何进入收容单元的声源必须经过三重延迟缓冲器处理。未经授权的录音设备、语音终端和人类声带不得在距井口 12 米范围内工作。",
      "每 72 小时由两名具备 Level 3 权限的工作人员完成一次声学回波校准，并将结果上传至本档案的事件索引。"
    ]
  },
  "description": {
    "title": "描述",
    "paragraphs": [
      "SCP-CN-███ 表现为一口直径 2.4 米、深度无法测量的混凝土工业井。其外观与 Site-19 建造前遗留的地下设施图纸不符。",
      "任何落入井内的声波将在 4 至 11 秒后返回。回声并非原始声音的简单复现，而是会以说话者熟悉的语气增加、删改或重排原始信息。修改内容通常指向收音者在未来 24 小时内即将做出的选择。",
      "回声不会主动离开井口，但持续记录同一段声音会使井内出现第二个声源。该声源无法通过麦克风定位，且会在停止录音后继续朗读。"
    ]
  },
  "discoveryLog": {
    "title": "发现记录",
    "paragraphs": [
      "2024 年 11 月，Site-19 旧排水系统翻修期间，维护组报告在空置管井中听到一段持续 19 分钟的倒放人声。",
      "初步检查确认该声音并非来自任何已登记设备。调查员将一枚金属扳手投入井中，回声在 8 秒后返回，并准确复述了调查员尚未提交的事故报告标题。"
    ]
  },
  "appendices": [
    {
      "tag": "附录 01",
      "title": "事件记录 / 04-RECALL",
      "body": "在一次未经授权的测试中，研究员 █████ 向井内朗读了自己的姓名。回声返回时使用了同一声音，但将姓名替换为“尚未归档的观察者”。测试在 17 秒后终止。研究员目前处于观察状态。"
    },
    {
      "tag": "附录 02",
      "title": "研究备注 / 声学组",
      "body": "SCP-CN-███ 的异常不在于它能“听见”声音，而在于它似乎将声音视为一种尚未完成的记录。请避免使用“预测”一词。"
    }
  ],
  "characteristics": [
    {
      "label": "异常类型",
      "value": "声学 / 信息",
      "level": 82,
      "tone": "cyan"
    },
    {
      "label": "危险等级",
      "value": "中等",
      "level": 58,
      "tone": "red"
    },
    {
      "label": "认知影响",
      "value": "显著",
      "level": 74,
      "tone": "amber"
    },
    {
      "label": "活性",
      "value": "持续",
      "level": 91,
      "tone": "red"
    },
    {
      "label": "可控性",
      "value": "可控",
      "level": 44,
      "tone": "cyan"
    }
  ],
  "radarMetrics": [
    {
      "label": "威胁性",
      "value": 64
    },
    {
      "label": "认知影响",
      "value": 78
    },
    {
      "label": "物理危险",
      "value": 36
    },
    {
      "label": "传播性",
      "value": 52
    },
    {
      "label": "不可预测性",
      "value": 88
    },
    {
      "label": "收容难度",
      "value": 61
    }
  ],
  "relatedArchives": [
    "SCP-CN-███-A / 声源索引",
    "SCP-CN-███-B / 井内记录缓存"
  ],
  "archiveStatus": "draft",
  "metadata": {
    "authorGithubLogin": "lantean600",
    "submittedAt": "2026-07-13T05:35:23.558Z"
  }
}
